{
  "id": "550e8400-e29b-41d4-a716-446655440000",
  "activityType": "550e8400-e29b-41d4-a716-446655440000",
  "title": "example_-title",
  "details": "example_etails",
  "severity": "example_verity",
  "hasAgriParcel": "550e8400-e29b-41d4-a716-446655440000",
  "validFrom": "2024-06-15T12:00:00Z",
  "validTo": "2024-06-15T12:00:00Z",
  "dateIssued": "2024-06-15T12:00:00Z",
  "quantityValue": "example_yValue",
  "relatedObservation": "550e8400-e29b-41d4-a716-446655440000"
}